No.     Time           Source                Destination           Protocol Length Info
      1 0.000000       172.18.0.4            172.18.0.2            MQTT     100    Publish Message (id=8) [home/sensors/umidade]

Frame 1: 100 bytes on wire (800 bits), 100 bytes captured (800 bits)
Linux cooked capture v2
    Protocol: IPv4 (0x0800)
    Interface index: 2
    Link-layer address type: Ethernet (1)
    Packet type: Unicast to us (0)
    Link-layer address length: 6
    Source: fa:55:00:00:6c:78 (fa:55:00:00:6c:78)
    Unused: 0000
Internet Protocol Version 4, Src: 172.18.0.4, Dst: 172.18.0.2
Transmission Control Protocol, Src Port: 43543, Dst Port: 1883, Seq: 1, Ack: 1, Len: 28
MQ Telemetry Transport Protocol, Publish Message

No.     Time           Source                Destination           Protocol Length Info
      2 0.000135       172.18.0.2            172.18.0.3            MQTT     100    Publish Message (id=14) [home/sensors/umidade]

Frame 2: 100 bytes on wire (800 bits), 100 bytes captured (800 bits)
Linux cooked capture v2
    Protocol: IPv4 (0x0800)
    Interface index: 2
    Link-layer address type: Ethernet (1)
    Packet type: Sent by us (4)
    Link-layer address length: 6
    Source: 8e:7c:46:c7:07:7e (8e:7c:46:c7:07:7e)
    Unused: 0000
Internet Protocol Version 4, Src: 172.18.0.2, Dst: 172.18.0.3
Transmission Control Protocol, Src Port: 1883, Dst Port: 50591, Seq: 1, Ack: 1, Len: 28
MQ Telemetry Transport Protocol, Publish Message

No.     Time           Source                Destination           Protocol Length Info
      3 0.000197       172.18.0.2            172.18.0.4            MQTT     76     Publish Ack (id=8)

Frame 3: 76 bytes on wire (608 bits), 76 bytes captured (608 bits)
Linux cooked capture v2
    Protocol: IPv4 (0x0800)
    Interface index: 2
    Link-layer address type: Ethernet (1)
    Packet type: Sent by us (4)
    Link-layer address length: 6
    Source: 8e:7c:46:c7:07:7e (8e:7c:46:c7:07:7e)
    Unused: 0000
Internet Protocol Version 4, Src: 172.18.0.2, Dst: 172.18.0.4
Transmission Control Protocol, Src Port: 1883, Dst Port: 43543, Seq: 1, Ack: 29, Len: 4
MQ Telemetry Transport Protocol, Publish Ack

No.     Time           Source                Destination           Protocol Length Info
      4 0.000213       172.18.0.4            172.18.0.2            TCP      72     43543 → 1883 [ACK] Seq=29 Ack=5 Win=502 Len=0 TSval=977935412 TSecr=4085235998

Frame 4: 72 bytes on wire (576 bits), 72 bytes captured (576 bits)
Linux cooked capture v2
    Protocol: IPv4 (0x0800)
    Interface index: 2
    Link-layer address type: Ethernet (1)
    Packet type: Unicast to us (0)
    Link-layer address length: 6
    Source: fa:55:00:00:6c:78 (fa:55:00:00:6c:78)
    Unused: 0000
Internet Protocol Version 4, Src: 172.18.0.4, Dst: 172.18.0.2
Transmission Control Protocol, Src Port: 43543, Dst Port: 1883, Seq: 29, Ack: 5, Len: 0

No.     Time           Source                Destination           Protocol Length Info
      5 0.000511       172.18.0.3            172.18.0.2            MQTT     76     Publish Ack (id=14)

Frame 5: 76 bytes on wire (608 bits), 76 bytes captured (608 bits)
Linux cooked capture v2
    Protocol: IPv4 (0x0800)
    Interface index: 2
    Link-layer address type: Ethernet (1)
    Packet type: Unicast to us (0)
    Link-layer address length: 6
    Source: be:57:97:2c:40:79 (be:57:97:2c:40:79)
    Unused: 0000
Internet Protocol Version 4, Src: 172.18.0.3, Dst: 172.18.0.2
Transmission Control Protocol, Src Port: 50591, Dst Port: 1883, Seq: 1, Ack: 29, Len: 4
MQ Telemetry Transport Protocol, Publish Ack

No.     Time           Source                Destination           Protocol Length Info
      6 0.000518       172.18.0.2            172.18.0.3            TCP      72     1883 → 50591 [ACK] Seq=29 Ack=5 Win=509 Len=0 TSval=1275783055 TSecr=4162227880

Frame 6: 72 bytes on wire (576 bits), 72 bytes captured (576 bits)
Linux cooked capture v2
    Protocol: IPv4 (0x0800)
    Interface index: 2
    Link-layer address type: Ethernet (1)
    Packet type: Sent by us (4)
    Link-layer address length: 6
    Source: 8e:7c:46:c7:07:7e (8e:7c:46:c7:07:7e)
    Unused: 0000
Internet Protocol Version 4, Src: 172.18.0.2, Dst: 172.18.0.3
Transmission Control Protocol, Src Port: 1883, Dst Port: 50591, Seq: 29, Ack: 5, Len: 0

No.     Time           Source                Destination           Protocol Length Info
      7 0.169036       172.18.0.6            172.18.0.2            MQTT     107    Publish Message (id=8) [home/sensors/temperatura]

Frame 7: 107 bytes on wire (856 bits), 107 bytes captured (856 bits)
Linux cooked capture v2
    Protocol: IPv4 (0x0800)
    Interface index: 2
    Link-layer address type: Ethernet (1)
    Packet type: Unicast to us (0)
    Link-layer address length: 6
    Source: 32:fe:c8:b9:42:c4 (32:fe:c8:b9:42:c4)
    Unused: 0000
Internet Protocol Version 4, Src: 172.18.0.6, Dst: 172.18.0.2
Transmission Control Protocol, Src Port: 34637, Dst Port: 1883, Seq: 1, Ack: 1, Len: 35
MQ Telemetry Transport Protocol, Publish Message

No.     Time           Source                Destination           Protocol Length Info
      8 0.169244       172.18.0.2            172.18.0.3            MQTT     107    Publish Message (id=15) [home/sensors/temperatura]

Frame 8: 107 bytes on wire (856 bits), 107 bytes captured (856 bits)
Linux cooked capture v2
    Protocol: IPv4 (0x0800)
    Interface index: 2
    Link-layer address type: Ethernet (1)
    Packet type: Sent by us (4)
    Link-layer address length: 6
    Source: 8e:7c:46:c7:07:7e (8e:7c:46:c7:07:7e)
    Unused: 0000
Internet Protocol Version 4, Src: 172.18.0.2, Dst: 172.18.0.3
Transmission Control Protocol, Src Port: 1883, Dst Port: 50591, Seq: 29, Ack: 5, Len: 35
MQ Telemetry Transport Protocol, Publish Message

No.     Time           Source                Destination           Protocol Length Info
      9 0.169299       172.18.0.2            172.18.0.6            MQTT     76     Publish Ack (id=8)

Frame 9: 76 bytes on wire (608 bits), 76 bytes captured (608 bits)
Linux cooked capture v2
    Protocol: IPv4 (0x0800)
    Interface index: 2
    Link-layer address type: Ethernet (1)
    Packet type: Sent by us (4)
    Link-layer address length: 6
    Source: 8e:7c:46:c7:07:7e (8e:7c:46:c7:07:7e)
    Unused: 0000
Internet Protocol Version 4, Src: 172.18.0.2, Dst: 172.18.0.6
Transmission Control Protocol, Src Port: 1883, Dst Port: 34637, Seq: 1, Ack: 36, Len: 4
MQ Telemetry Transport Protocol, Publish Ack

No.     Time           Source                Destination           Protocol Length Info
     10 0.169329       172.18.0.6            172.18.0.2            TCP      72     34637 → 1883 [ACK] Seq=36 Ack=5 Win=502 Len=0 TSval=2820499992 TSecr=1873319811

Frame 10: 72 bytes on wire (576 bits), 72 bytes captured (576 bits)
Linux cooked capture v2
    Protocol: IPv4 (0x0800)
    Interface index: 2
    Link-layer address type: Ethernet (1)
    Packet type: Unicast to us (0)
    Link-layer address length: 6
    Source: 32:fe:c8:b9:42:c4 (32:fe:c8:b9:42:c4)
    Unused: 0000
Internet Protocol Version 4, Src: 172.18.0.6, Dst: 172.18.0.2
Transmission Control Protocol, Src Port: 34637, Dst Port: 1883, Seq: 36, Ack: 5, Len: 0

No.     Time           Source                Destination           Protocol Length Info
     11 0.169548       172.18.0.3            172.18.0.2            MQTT     76     Publish Ack (id=15)

Frame 11: 76 bytes on wire (608 bits), 76 bytes captured (608 bits)
Linux cooked capture v2
    Protocol: IPv4 (0x0800)
    Interface index: 2
    Link-layer address type: Ethernet (1)
    Packet type: Unicast to us (0)
    Link-layer address length: 6
    Source: be:57:97:2c:40:79 (be:57:97:2c:40:79)
    Unused: 0000
Internet Protocol Version 4, Src: 172.18.0.3, Dst: 172.18.0.2
Transmission Control Protocol, Src Port: 50591, Dst Port: 1883, Seq: 5, Ack: 64, Len: 4
MQ Telemetry Transport Protocol, Publish Ack

No.     Time           Source                Destination           Protocol Length Info
     12 0.169556       172.18.0.2            172.18.0.3            TCP      72     1883 → 50591 [ACK] Seq=64 Ack=9 Win=509 Len=0 TSval=1275783224 TSecr=4162228049

Frame 12: 72 bytes on wire (576 bits), 72 bytes captured (576 bits)
Linux cooked capture v2
    Protocol: IPv4 (0x0800)
    Interface index: 2
    Link-layer address type: Ethernet (1)
    Packet type: Sent by us (4)
    Link-layer address length: 6
    Source: 8e:7c:46:c7:07:7e (8e:7c:46:c7:07:7e)
    Unused: 0000
Internet Protocol Version 4, Src: 172.18.0.2, Dst: 172.18.0.3
Transmission Control Protocol, Src Port: 1883, Dst Port: 50591, Seq: 64, Ack: 9, Len: 0

No.     Time           Source                Destination           Protocol Length Info
     13 5.004621       172.18.0.4            172.18.0.2            MQTT     100    Publish Message (id=9) [home/sensors/umidade]

Frame 13: 100 bytes on wire (800 bits), 100 bytes captured (800 bits)
Linux cooked capture v2
    Protocol: IPv4 (0x0800)
    Interface index: 2
    Link-layer address type: Ethernet (1)
    Packet type: Unicast to us (0)
    Link-layer address length: 6
    Source: fa:55:00:00:6c:78 (fa:55:00:00:6c:78)
    Unused: 0000
Internet Protocol Version 4, Src: 172.18.0.4, Dst: 172.18.0.2
Transmission Control Protocol, Src Port: 43543, Dst Port: 1883, Seq: 29, Ack: 5, Len: 28
MQ Telemetry Transport Protocol, Publish Message

No.     Time           Source                Destination           Protocol Length Info
     14 5.004791       172.18.0.2            172.18.0.3            MQTT     100    Publish Message (id=16) [home/sensors/umidade]

Frame 14: 100 bytes on wire (800 bits), 100 bytes captured (800 bits)
Linux cooked capture v2
    Protocol: IPv4 (0x0800)
    Interface index: 2
    Link-layer address type: Ethernet (1)
    Packet type: Sent by us (4)
    Link-layer address length: 6
    Source: 8e:7c:46:c7:07:7e (8e:7c:46:c7:07:7e)
    Unused: 0000
Internet Protocol Version 4, Src: 172.18.0.2, Dst: 172.18.0.3
Transmission Control Protocol, Src Port: 1883, Dst Port: 50591, Seq: 64, Ack: 9, Len: 28
MQ Telemetry Transport Protocol, Publish Message

No.     Time           Source                Destination           Protocol Length Info
     15 5.004853       172.18.0.2            172.18.0.4            MQTT     76     Publish Ack (id=9)

Frame 15: 76 bytes on wire (608 bits), 76 bytes captured (608 bits)
Linux cooked capture v2
    Protocol: IPv4 (0x0800)
    Interface index: 2
    Link-layer address type: Ethernet (1)
    Packet type: Sent by us (4)
    Link-layer address length: 6
    Source: 8e:7c:46:c7:07:7e (8e:7c:46:c7:07:7e)
    Unused: 0000
Internet Protocol Version 4, Src: 172.18.0.2, Dst: 172.18.0.4
Transmission Control Protocol, Src Port: 1883, Dst Port: 43543, Seq: 5, Ack: 57, Len: 4
MQ Telemetry Transport Protocol, Publish Ack

No.     Time           Source                Destination           Protocol Length Info
     16 5.004873       172.18.0.4            172.18.0.2            TCP      72     43543 → 1883 [ACK] Seq=57 Ack=9 Win=502 Len=0 TSval=977940416 TSecr=4085241002

Frame 16: 72 bytes on wire (576 bits), 72 bytes captured (576 bits)
Linux cooked capture v2
    Protocol: IPv4 (0x0800)
    Interface index: 2
    Link-layer address type: Ethernet (1)
    Packet type: Unicast to us (0)
    Link-layer address length: 6
    Source: fa:55:00:00:6c:78 (fa:55:00:00:6c:78)
    Unused: 0000
Internet Protocol Version 4, Src: 172.18.0.4, Dst: 172.18.0.2
Transmission Control Protocol, Src Port: 43543, Dst Port: 1883, Seq: 57, Ack: 9, Len: 0

No.     Time           Source                Destination           Protocol Length Info
     17 5.005137       172.18.0.3            172.18.0.2            MQTT     76     Publish Ack (id=16)

Frame 17: 76 bytes on wire (608 bits), 76 bytes captured (608 bits)
Linux cooked capture v2
    Protocol: IPv4 (0x0800)
    Interface index: 2
    Link-layer address type: Ethernet (1)
    Packet type: Unicast to us (0)
    Link-layer address length: 6
    Source: be:57:97:2c:40:79 (be:57:97:2c:40:79)
    Unused: 0000
Internet Protocol Version 4, Src: 172.18.0.3, Dst: 172.18.0.2
Transmission Control Protocol, Src Port: 50591, Dst Port: 1883, Seq: 9, Ack: 92, Len: 4
MQ Telemetry Transport Protocol, Publish Ack

No.     Time           Source                Destination           Protocol Length Info
     18 5.005145       172.18.0.2            172.18.0.3            TCP      72     1883 → 50591 [ACK] Seq=92 Ack=13 Win=509 Len=0 TSval=1275788060 TSecr=4162232885

Frame 18: 72 bytes on wire (576 bits), 72 bytes captured (576 bits)
Linux cooked capture v2
    Protocol: IPv4 (0x0800)
    Interface index: 2
    Link-layer address type: Ethernet (1)
    Packet type: Sent by us (4)
    Link-layer address length: 6
    Source: 8e:7c:46:c7:07:7e (8e:7c:46:c7:07:7e)
    Unused: 0000
Internet Protocol Version 4, Src: 172.18.0.2, Dst: 172.18.0.3
Transmission Control Protocol, Src Port: 1883, Dst Port: 50591, Seq: 92, Ack: 13, Len: 0

No.     Time           Source                Destination           Protocol Length Info
     19 5.174671       172.18.0.6            172.18.0.2            MQTT     107    Publish Message (id=9) [home/sensors/temperatura]

Frame 19: 107 bytes on wire (856 bits), 107 bytes captured (856 bits)
Linux cooked capture v2
    Protocol: IPv4 (0x0800)
    Interface index: 2
    Link-layer address type: Ethernet (1)
    Packet type: Unicast to us (0)
    Link-layer address length: 6
    Source: 32:fe:c8:b9:42:c4 (32:fe:c8:b9:42:c4)
    Unused: 0000
Internet Protocol Version 4, Src: 172.18.0.6, Dst: 172.18.0.2
Transmission Control Protocol, Src Port: 34637, Dst Port: 1883, Seq: 36, Ack: 5, Len: 35
MQ Telemetry Transport Protocol, Publish Message

No.     Time           Source                Destination           Protocol Length Info
     20 5.174895       172.18.0.2            172.18.0.3            MQTT     107    Publish Message (id=17) [home/sensors/temperatura]

Frame 20: 107 bytes on wire (856 bits), 107 bytes captured (856 bits)
Linux cooked capture v2
    Protocol: IPv4 (0x0800)
    Interface index: 2
    Link-layer address type: Ethernet (1)
    Packet type: Sent by us (4)
    Link-layer address length: 6
    Source: 8e:7c:46:c7:07:7e (8e:7c:46:c7:07:7e)
    Unused: 0000
Internet Protocol Version 4, Src: 172.18.0.2, Dst: 172.18.0.3
Transmission Control Protocol, Src Port: 1883, Dst Port: 50591, Seq: 92, Ack: 13, Len: 35
MQ Telemetry Transport Protocol, Publish Message

No.     Time           Source                Destination           Protocol Length Info
     21 5.174968       172.18.0.2            172.18.0.6            MQTT     76     Publish Ack (id=9)

Frame 21: 76 bytes on wire (608 bits), 76 bytes captured (608 bits)
Linux cooked capture v2
    Protocol: IPv4 (0x0800)
    Interface index: 2
    Link-layer address type: Ethernet (1)
    Packet type: Sent by us (4)
    Link-layer address length: 6
    Source: 8e:7c:46:c7:07:7e (8e:7c:46:c7:07:7e)
    Unused: 0000
Internet Protocol Version 4, Src: 172.18.0.2, Dst: 172.18.0.6
Transmission Control Protocol, Src Port: 1883, Dst Port: 34637, Seq: 5, Ack: 71, Len: 4
MQ Telemetry Transport Protocol, Publish Ack

No.     Time           Source                Destination           Protocol Length Info
     22 5.175037       172.18.0.6            172.18.0.2            TCP      72     34637 → 1883 [ACK] Seq=71 Ack=9 Win=502 Len=0 TSval=2820504998 TSecr=1873324817

Frame 22: 72 bytes on wire (576 bits), 72 bytes captured (576 bits)
Linux cooked capture v2
    Protocol: IPv4 (0x0800)
    Interface index: 2
    Link-layer address type: Ethernet (1)
    Packet type: Unicast to us (0)
    Link-layer address length: 6
    Source: 32:fe:c8:b9:42:c4 (32:fe:c8:b9:42:c4)
    Unused: 0000
Internet Protocol Version 4, Src: 172.18.0.6, Dst: 172.18.0.2
Transmission Control Protocol, Src Port: 34637, Dst Port: 1883, Seq: 71, Ack: 9, Len: 0

No.     Time           Source                Destination           Protocol Length Info
     23 5.175318       172.18.0.3            172.18.0.2            MQTT     76     Publish Ack (id=17)

Frame 23: 76 bytes on wire (608 bits), 76 bytes captured (608 bits)
Linux cooked capture v2
    Protocol: IPv4 (0x0800)
    Interface index: 2
    Link-layer address type: Ethernet (1)
    Packet type: Unicast to us (0)
    Link-layer address length: 6
    Source: be:57:97:2c:40:79 (be:57:97:2c:40:79)
    Unused: 0000
Internet Protocol Version 4, Src: 172.18.0.3, Dst: 172.18.0.2
Transmission Control Protocol, Src Port: 50591, Dst Port: 1883, Seq: 13, Ack: 127, Len: 4
MQ Telemetry Transport Protocol, Publish Ack

No.     Time           Source                Destination           Protocol Length Info
     24 5.175327       172.18.0.2            172.18.0.3            TCP      72     1883 → 50591 [ACK] Seq=127 Ack=17 Win=509 Len=0 TSval=1275788230 TSecr=4162233055

Frame 24: 72 bytes on wire (576 bits), 72 bytes captured (576 bits)
Linux cooked capture v2
    Protocol: IPv4 (0x0800)
    Interface index: 2
    Link-layer address type: Ethernet (1)
    Packet type: Sent by us (4)
    Link-layer address length: 6
    Source: 8e:7c:46:c7:07:7e (8e:7c:46:c7:07:7e)
    Unused: 0000
Internet Protocol Version 4, Src: 172.18.0.2, Dst: 172.18.0.3
Transmission Control Protocol, Src Port: 1883, Dst Port: 50591, Seq: 127, Ack: 17, Len: 0

No.     Time           Source                Destination           Protocol Length Info
     25 10.008826      172.18.0.4            172.18.0.2            MQTT     100    Publish Message (id=10) [home/sensors/umidade]

Frame 25: 100 bytes on wire (800 bits), 100 bytes captured (800 bits)
Linux cooked capture v2
    Protocol: IPv4 (0x0800)
    Interface index: 2
    Link-layer address type: Ethernet (1)
    Packet type: Unicast to us (0)
    Link-layer address length: 6
    Source: fa:55:00:00:6c:78 (fa:55:00:00:6c:78)
    Unused: 0000
Internet Protocol Version 4, Src: 172.18.0.4, Dst: 172.18.0.2
Transmission Control Protocol, Src Port: 43543, Dst Port: 1883, Seq: 57, Ack: 9, Len: 28
MQ Telemetry Transport Protocol, Publish Message

No.     Time           Source                Destination           Protocol Length Info
     26 10.009282      172.18.0.2            172.18.0.3            MQTT     100    Publish Message (id=18) [home/sensors/umidade]

Frame 26: 100 bytes on wire (800 bits), 100 bytes captured (800 bits)
Linux cooked capture v2
    Protocol: IPv4 (0x0800)
    Interface index: 2
    Link-layer address type: Ethernet (1)
    Packet type: Sent by us (4)
    Link-layer address length: 6
    Source: 8e:7c:46:c7:07:7e (8e:7c:46:c7:07:7e)
    Unused: 0000
Internet Protocol Version 4, Src: 172.18.0.2, Dst: 172.18.0.3
Transmission Control Protocol, Src Port: 1883, Dst Port: 50591, Seq: 127, Ack: 17, Len: 28
MQ Telemetry Transport Protocol, Publish Message

No.     Time           Source                Destination           Protocol Length Info
     27 10.009546      172.18.0.2            172.18.0.4            MQTT     76     Publish Ack (id=10)

Frame 27: 76 bytes on wire (608 bits), 76 bytes captured (608 bits)
Linux cooked capture v2
    Protocol: IPv4 (0x0800)
    Interface index: 2
    Link-layer address type: Ethernet (1)
    Packet type: Sent by us (4)
    Link-layer address length: 6
    Source: 8e:7c:46:c7:07:7e (8e:7c:46:c7:07:7e)
    Unused: 0000
Internet Protocol Version 4, Src: 172.18.0.2, Dst: 172.18.0.4
Transmission Control Protocol, Src Port: 1883, Dst Port: 43543, Seq: 9, Ack: 85, Len: 4
MQ Telemetry Transport Protocol, Publish Ack

No.     Time           Source                Destination           Protocol Length Info
     28 10.009595      172.18.0.4            172.18.0.2            TCP      72     43543 → 1883 [ACK] Seq=85 Ack=13 Win=502 Len=0 TSval=977945423 TSecr=4085246009

Frame 28: 72 bytes on wire (576 bits), 72 bytes captured (576 bits)
Linux cooked capture v2
    Protocol: IPv4 (0x0800)
    Interface index: 2
    Link-layer address type: Ethernet (1)
    Packet type: Unicast to us (0)
    Link-layer address length: 6
    Source: fa:55:00:00:6c:78 (fa:55:00:00:6c:78)
    Unused: 0000
Internet Protocol Version 4, Src: 172.18.0.4, Dst: 172.18.0.2
Transmission Control Protocol, Src Port: 43543, Dst Port: 1883, Seq: 85, Ack: 13, Len: 0

No.     Time           Source                Destination           Protocol Length Info
     29 10.009983      172.18.0.3            172.18.0.2            MQTT     76     Publish Ack (id=18)

Frame 29: 76 bytes on wire (608 bits), 76 bytes captured (608 bits)
Linux cooked capture v2
    Protocol: IPv4 (0x0800)
    Interface index: 2
    Link-layer address type: Ethernet (1)
    Packet type: Unicast to us (0)
    Link-layer address length: 6
    Source: be:57:97:2c:40:79 (be:57:97:2c:40:79)
    Unused: 0000
Internet Protocol Version 4, Src: 172.18.0.3, Dst: 172.18.0.2
Transmission Control Protocol, Src Port: 50591, Dst Port: 1883, Seq: 17, Ack: 155, Len: 4
MQ Telemetry Transport Protocol, Publish Ack

No.     Time           Source                Destination           Protocol Length Info
     30 10.009992      172.18.0.2            172.18.0.3            TCP      72     1883 → 50591 [ACK] Seq=155 Ack=21 Win=509 Len=0 TSval=1275793066 TSecr=4162237891

Frame 30: 72 bytes on wire (576 bits), 72 bytes captured (576 bits)
Linux cooked capture v2
    Protocol: IPv4 (0x0800)
    Interface index: 2
    Link-layer address type: Ethernet (1)
    Packet type: Sent by us (4)
    Link-layer address length: 6
    Source: 8e:7c:46:c7:07:7e (8e:7c:46:c7:07:7e)
    Unused: 0000
Internet Protocol Version 4, Src: 172.18.0.2, Dst: 172.18.0.3
Transmission Control Protocol, Src Port: 1883, Dst Port: 50591, Seq: 155, Ack: 21, Len: 0

No.     Time           Source                Destination           Protocol Length Info
     31 10.178733      172.18.0.6            172.18.0.2            MQTT     107    Publish Message (id=10) [home/sensors/temperatura]

Frame 31: 107 bytes on wire (856 bits), 107 bytes captured (856 bits)
Linux cooked capture v2
    Protocol: IPv4 (0x0800)
    Interface index: 2
    Link-layer address type: Ethernet (1)
    Packet type: Unicast to us (0)
    Link-layer address length: 6
    Source: 32:fe:c8:b9:42:c4 (32:fe:c8:b9:42:c4)
    Unused: 0000
Internet Protocol Version 4, Src: 172.18.0.6, Dst: 172.18.0.2
Transmission Control Protocol, Src Port: 34637, Dst Port: 1883, Seq: 71, Ack: 9, Len: 35
MQ Telemetry Transport Protocol, Publish Message

No.     Time           Source                Destination           Protocol Length Info
     32 10.179043      172.18.0.2            172.18.0.3            MQTT     107    Publish Message (id=19) [home/sensors/temperatura]

Frame 32: 107 bytes on wire (856 bits), 107 bytes captured (856 bits)
Linux cooked capture v2
    Protocol: IPv4 (0x0800)
    Interface index: 2
    Link-layer address type: Ethernet (1)
    Packet type: Sent by us (4)
    Link-layer address length: 6
    Source: 8e:7c:46:c7:07:7e (8e:7c:46:c7:07:7e)
    Unused: 0000
Internet Protocol Version 4, Src: 172.18.0.2, Dst: 172.18.0.3
Transmission Control Protocol, Src Port: 1883, Dst Port: 50591, Seq: 155, Ack: 21, Len: 35
MQ Telemetry Transport Protocol, Publish Message

No.     Time           Source                Destination           Protocol Length Info
     33 10.179166      172.18.0.2            172.18.0.6            MQTT     76     Publish Ack (id=10)

Frame 33: 76 bytes on wire (608 bits), 76 bytes captured (608 bits)
Linux cooked capture v2
    Protocol: IPv4 (0x0800)
    Interface index: 2
    Link-layer address type: Ethernet (1)
    Packet type: Sent by us (4)
    Link-layer address length: 6
    Source: 8e:7c:46:c7:07:7e (8e:7c:46:c7:07:7e)
    Unused: 0000
Internet Protocol Version 4, Src: 172.18.0.2, Dst: 172.18.0.6
Transmission Control Protocol, Src Port: 1883, Dst Port: 34637, Seq: 9, Ack: 106, Len: 4
MQ Telemetry Transport Protocol, Publish Ack

No.     Time           Source                Destination           Protocol Length Info
     34 10.179184      172.18.0.6            172.18.0.2            TCP      72     34637 → 1883 [ACK] Seq=106 Ack=13 Win=502 Len=0 TSval=2820510004 TSecr=1873329823

Frame 34: 72 bytes on wire (576 bits), 72 bytes captured (576 bits)
Linux cooked capture v2
    Protocol: IPv4 (0x0800)
    Interface index: 2
    Link-layer address type: Ethernet (1)
    Packet type: Unicast to us (0)
    Link-layer address length: 6
    Source: 32:fe:c8:b9:42:c4 (32:fe:c8:b9:42:c4)
    Unused: 0000
Internet Protocol Version 4, Src: 172.18.0.6, Dst: 172.18.0.2
Transmission Control Protocol, Src Port: 34637, Dst Port: 1883, Seq: 106, Ack: 13, Len: 0

No.     Time           Source                Destination           Protocol Length Info
     35 10.179508      172.18.0.3            172.18.0.2            MQTT     76     Publish Ack (id=19)

Frame 35: 76 bytes on wire (608 bits), 76 bytes captured (608 bits)
Linux cooked capture v2
    Protocol: IPv4 (0x0800)
    Interface index: 2
    Link-layer address type: Ethernet (1)
    Packet type: Unicast to us (0)
    Link-layer address length: 6
    Source: be:57:97:2c:40:79 (be:57:97:2c:40:79)
    Unused: 0000
Internet Protocol Version 4, Src: 172.18.0.3, Dst: 172.18.0.2
Transmission Control Protocol, Src Port: 50591, Dst Port: 1883, Seq: 21, Ack: 190, Len: 4
MQ Telemetry Transport Protocol, Publish Ack

No.     Time           Source                Destination           Protocol Length Info
     36 10.179516      172.18.0.2            172.18.0.3            TCP      72     1883 → 50591 [ACK] Seq=190 Ack=25 Win=509 Len=0 TSval=1275793236 TSecr=4162238061

Frame 36: 72 bytes on wire (576 bits), 72 bytes captured (576 bits)
Linux cooked capture v2
    Protocol: IPv4 (0x0800)
    Interface index: 2
    Link-layer address type: Ethernet (1)
    Packet type: Sent by us (4)
    Link-layer address length: 6
    Source: 8e:7c:46:c7:07:7e (8e:7c:46:c7:07:7e)
    Unused: 0000
Internet Protocol Version 4, Src: 172.18.0.2, Dst: 172.18.0.3
Transmission Control Protocol, Src Port: 1883, Dst Port: 50591, Seq: 190, Ack: 25, Len: 0

No.     Time           Source                Destination           Protocol Length Info
     37 15.014232      172.18.0.4            172.18.0.2            MQTT     100    Publish Message (id=11) [home/sensors/umidade]

Frame 37: 100 bytes on wire (800 bits), 100 bytes captured (800 bits)
Linux cooked capture v2
    Protocol: IPv4 (0x0800)
    Interface index: 2
    Link-layer address type: Ethernet (1)
    Packet type: Unicast to us (0)
    Link-layer address length: 6
    Source: fa:55:00:00:6c:78 (fa:55:00:00:6c:78)
    Unused: 0000
Internet Protocol Version 4, Src: 172.18.0.4, Dst: 172.18.0.2
Transmission Control Protocol, Src Port: 43543, Dst Port: 1883, Seq: 85, Ack: 13, Len: 28
MQ Telemetry Transport Protocol, Publish Message

No.     Time           Source                Destination           Protocol Length Info
     38 15.014372      172.18.0.2            172.18.0.3            MQTT     100    Publish Message (id=20) [home/sensors/umidade]

Frame 38: 100 bytes on wire (800 bits), 100 bytes captured (800 bits)
Linux cooked capture v2
    Protocol: IPv4 (0x0800)
    Interface index: 2
    Link-layer address type: Ethernet (1)
    Packet type: Sent by us (4)
    Link-layer address length: 6
    Source: 8e:7c:46:c7:07:7e (8e:7c:46:c7:07:7e)
    Unused: 0000
Internet Protocol Version 4, Src: 172.18.0.2, Dst: 172.18.0.3
Transmission Control Protocol, Src Port: 1883, Dst Port: 50591, Seq: 190, Ack: 25, Len: 28
MQ Telemetry Transport Protocol, Publish Message

No.     Time           Source                Destination           Protocol Length Info
     39 15.014439      172.18.0.2            172.18.0.4            MQTT     76     Publish Ack (id=11)

Frame 39: 76 bytes on wire (608 bits), 76 bytes captured (608 bits)
Linux cooked capture v2
    Protocol: IPv4 (0x0800)
    Interface index: 2
    Link-layer address type: Ethernet (1)
    Packet type: Sent by us (4)
    Link-layer address length: 6
    Source: 8e:7c:46:c7:07:7e (8e:7c:46:c7:07:7e)
    Unused: 0000
Internet Protocol Version 4, Src: 172.18.0.2, Dst: 172.18.0.4
Transmission Control Protocol, Src Port: 1883, Dst Port: 43543, Seq: 13, Ack: 113, Len: 4
MQ Telemetry Transport Protocol, Publish Ack

No.     Time           Source                Destination           Protocol Length Info
     40 15.014456      172.18.0.4            172.18.0.2            TCP      72     43543 → 1883 [ACK] Seq=113 Ack=17 Win=502 Len=0 TSval=977950428 TSecr=4085251014

Frame 40: 72 bytes on wire (576 bits), 72 bytes captured (576 bits)
Linux cooked capture v2
    Protocol: IPv4 (0x0800)
    Interface index: 2
    Link-layer address type: Ethernet (1)
    Packet type: Unicast to us (0)
    Link-layer address length: 6
    Source: fa:55:00:00:6c:78 (fa:55:00:00:6c:78)
    Unused: 0000
Internet Protocol Version 4, Src: 172.18.0.4, Dst: 172.18.0.2
Transmission Control Protocol, Src Port: 43543, Dst Port: 1883, Seq: 113, Ack: 17, Len: 0

No.     Time           Source                Destination           Protocol Length Info
     41 15.014784      172.18.0.3            172.18.0.2            MQTT     76     Publish Ack (id=20)

Frame 41: 76 bytes on wire (608 bits), 76 bytes captured (608 bits)
Linux cooked capture v2
    Protocol: IPv4 (0x0800)
    Interface index: 2
    Link-layer address type: Ethernet (1)
    Packet type: Unicast to us (0)
    Link-layer address length: 6
    Source: be:57:97:2c:40:79 (be:57:97:2c:40:79)
    Unused: 0000
Internet Protocol Version 4, Src: 172.18.0.3, Dst: 172.18.0.2
Transmission Control Protocol, Src Port: 50591, Dst Port: 1883, Seq: 25, Ack: 218, Len: 4
MQ Telemetry Transport Protocol, Publish Ack

No.     Time           Source                Destination           Protocol Length Info
     42 15.014793      172.18.0.2            172.18.0.3            TCP      72     1883 → 50591 [ACK] Seq=218 Ack=29 Win=509 Len=0 TSval=1275798071 TSecr=4162242896

Frame 42: 72 bytes on wire (576 bits), 72 bytes captured (576 bits)
Linux cooked capture v2
    Protocol: IPv4 (0x0800)
    Interface index: 2
    Link-layer address type: Ethernet (1)
    Packet type: Sent by us (4)
    Link-layer address length: 6
    Source: 8e:7c:46:c7:07:7e (8e:7c:46:c7:07:7e)
    Unused: 0000
Internet Protocol Version 4, Src: 172.18.0.2, Dst: 172.18.0.3
Transmission Control Protocol, Src Port: 1883, Dst Port: 50591, Seq: 218, Ack: 29, Len: 0

No.     Time           Source                Destination           Protocol Length Info
     43 15.184096      172.18.0.6            172.18.0.2            MQTT     107    Publish Message (id=11) [home/sensors/temperatura]

Frame 43: 107 bytes on wire (856 bits), 107 bytes captured (856 bits)
Linux cooked capture v2
    Protocol: IPv4 (0x0800)
    Interface index: 2
    Link-layer address type: Ethernet (1)
    Packet type: Unicast to us (0)
    Link-layer address length: 6
    Source: 32:fe:c8:b9:42:c4 (32:fe:c8:b9:42:c4)
    Unused: 0000
Internet Protocol Version 4, Src: 172.18.0.6, Dst: 172.18.0.2
Transmission Control Protocol, Src Port: 34637, Dst Port: 1883, Seq: 106, Ack: 13, Len: 35
MQ Telemetry Transport Protocol, Publish Message

No.     Time           Source                Destination           Protocol Length Info
     44 15.184284      172.18.0.2            172.18.0.3            MQTT     107    Publish Message (id=21) [home/sensors/temperatura]

Frame 44: 107 bytes on wire (856 bits), 107 bytes captured (856 bits)
Linux cooked capture v2
    Protocol: IPv4 (0x0800)
    Interface index: 2
    Link-layer address type: Ethernet (1)
    Packet type: Sent by us (4)
    Link-layer address length: 6
    Source: 8e:7c:46:c7:07:7e (8e:7c:46:c7:07:7e)
    Unused: 0000
Internet Protocol Version 4, Src: 172.18.0.2, Dst: 172.18.0.3
Transmission Control Protocol, Src Port: 1883, Dst Port: 50591, Seq: 218, Ack: 29, Len: 35
MQ Telemetry Transport Protocol, Publish Message

No.     Time           Source                Destination           Protocol Length Info
     45 15.184333      172.18.0.2            172.18.0.6            MQTT     76     Publish Ack (id=11)

Frame 45: 76 bytes on wire (608 bits), 76 bytes captured (608 bits)
Linux cooked capture v2
    Protocol: IPv4 (0x0800)
    Interface index: 2
    Link-layer address type: Ethernet (1)
    Packet type: Sent by us (4)
    Link-layer address length: 6
    Source: 8e:7c:46:c7:07:7e (8e:7c:46:c7:07:7e)
    Unused: 0000
Internet Protocol Version 4, Src: 172.18.0.2, Dst: 172.18.0.6
Transmission Control Protocol, Src Port: 1883, Dst Port: 34637, Seq: 13, Ack: 141, Len: 4
MQ Telemetry Transport Protocol, Publish Ack

No.     Time           Source                Destination           Protocol Length Info
     46 15.184367      172.18.0.6            172.18.0.2            TCP      72     34637 → 1883 [ACK] Seq=141 Ack=17 Win=502 Len=0 TSval=2820515009 TSecr=1873334828

Frame 46: 72 bytes on wire (576 bits), 72 bytes captured (576 bits)
Linux cooked capture v2
    Protocol: IPv4 (0x0800)
    Interface index: 2
    Link-layer address type: Ethernet (1)
    Packet type: Unicast to us (0)
    Link-layer address length: 6
    Source: 32:fe:c8:b9:42:c4 (32:fe:c8:b9:42:c4)
    Unused: 0000
Internet Protocol Version 4, Src: 172.18.0.6, Dst: 172.18.0.2
Transmission Control Protocol, Src Port: 34637, Dst Port: 1883, Seq: 141, Ack: 17, Len: 0

No.     Time           Source                Destination           Protocol Length Info
     47 15.184667      172.18.0.3            172.18.0.2            MQTT     76     Publish Ack (id=21)

Frame 47: 76 bytes on wire (608 bits), 76 bytes captured (608 bits)
Linux cooked capture v2
    Protocol: IPv4 (0x0800)
    Interface index: 2
    Link-layer address type: Ethernet (1)
    Packet type: Unicast to us (0)
    Link-layer address length: 6
    Source: be:57:97:2c:40:79 (be:57:97:2c:40:79)
    Unused: 0000
Internet Protocol Version 4, Src: 172.18.0.3, Dst: 172.18.0.2
Transmission Control Protocol, Src Port: 50591, Dst Port: 1883, Seq: 29, Ack: 253, Len: 4
MQ Telemetry Transport Protocol, Publish Ack

No.     Time           Source                Destination           Protocol Length Info
     48 15.184681      172.18.0.2            172.18.0.3            TCP      72     1883 → 50591 [ACK] Seq=253 Ack=33 Win=509 Len=0 TSval=1275798241 TSecr=4162243066

Frame 48: 72 bytes on wire (576 bits), 72 bytes captured (576 bits)
Linux cooked capture v2
    Protocol: IPv4 (0x0800)
    Interface index: 2
    Link-layer address type: Ethernet (1)
    Packet type: Sent by us (4)
    Link-layer address length: 6
    Source: 8e:7c:46:c7:07:7e (8e:7c:46:c7:07:7e)
    Unused: 0000
Internet Protocol Version 4, Src: 172.18.0.2, Dst: 172.18.0.3
Transmission Control Protocol, Src Port: 1883, Dst Port: 50591, Seq: 253, Ack: 33, Len: 0

No.     Time           Source                Destination           Protocol Length Info
     49 20.019843      172.18.0.4            172.18.0.2            MQTT     100    Publish Message (id=12) [home/sensors/umidade]

Frame 49: 100 bytes on wire (800 bits), 100 bytes captured (800 bits)
Linux cooked capture v2
    Protocol: IPv4 (0x0800)
    Interface index: 2
    Link-layer address type: Ethernet (1)
    Packet type: Unicast to us (0)
    Link-layer address length: 6
    Source: fa:55:00:00:6c:78 (fa:55:00:00:6c:78)
    Unused: 0000
Internet Protocol Version 4, Src: 172.18.0.4, Dst: 172.18.0.2
Transmission Control Protocol, Src Port: 43543, Dst Port: 1883, Seq: 113, Ack: 17, Len: 28
MQ Telemetry Transport Protocol, Publish Message

No.     Time           Source                Destination           Protocol Length Info
     50 20.020000      172.18.0.2            172.18.0.3            MQTT     100    Publish Message (id=22) [home/sensors/umidade]

Frame 50: 100 bytes on wire (800 bits), 100 bytes captured (800 bits)
Linux cooked capture v2
    Protocol: IPv4 (0x0800)
    Interface index: 2
    Link-layer address type: Ethernet (1)
    Packet type: Sent by us (4)
    Link-layer address length: 6
    Source: 8e:7c:46:c7:07:7e (8e:7c:46:c7:07:7e)
    Unused: 0000
Internet Protocol Version 4, Src: 172.18.0.2, Dst: 172.18.0.3
Transmission Control Protocol, Src Port: 1883, Dst Port: 50591, Seq: 253, Ack: 33, Len: 28
MQ Telemetry Transport Protocol, Publish Message

No.     Time           Source                Destination           Protocol Length Info
     51 20.020061      172.18.0.2            172.18.0.4            MQTT     76     Publish Ack (id=12)

Frame 51: 76 bytes on wire (608 bits), 76 bytes captured (608 bits)
Linux cooked capture v2
    Protocol: IPv4 (0x0800)
    Interface index: 2
    Link-layer address type: Ethernet (1)
    Packet type: Sent by us (4)
    Link-layer address length: 6
    Source: 8e:7c:46:c7:07:7e (8e:7c:46:c7:07:7e)
    Unused: 0000
Internet Protocol Version 4, Src: 172.18.0.2, Dst: 172.18.0.4
Transmission Control Protocol, Src Port: 1883, Dst Port: 43543, Seq: 17, Ack: 141, Len: 4
MQ Telemetry Transport Protocol, Publish Ack

No.     Time           Source                Destination           Protocol Length Info
     52 20.020079      172.18.0.4            172.18.0.2            TCP      72     43543 → 1883 [ACK] Seq=141 Ack=21 Win=502 Len=0 TSval=977955433 TSecr=4085256019

Frame 52: 72 bytes on wire (576 bits), 72 bytes captured (576 bits)
Linux cooked capture v2
    Protocol: IPv4 (0x0800)
    Interface index: 2
    Link-layer address type: Ethernet (1)
    Packet type: Unicast to us (0)
    Link-layer address length: 6
    Source: fa:55:00:00:6c:78 (fa:55:00:00:6c:78)
    Unused: 0000
Internet Protocol Version 4, Src: 172.18.0.4, Dst: 172.18.0.2
Transmission Control Protocol, Src Port: 43543, Dst Port: 1883, Seq: 141, Ack: 21, Len: 0

No.     Time           Source                Destination           Protocol Length Info
     53 20.020337      172.18.0.3            172.18.0.2            MQTT     76     Publish Ack (id=22)

Frame 53: 76 bytes on wire (608 bits), 76 bytes captured (608 bits)
Linux cooked capture v2
    Protocol: IPv4 (0x0800)
    Interface index: 2
    Link-layer address type: Ethernet (1)
    Packet type: Unicast to us (0)
    Link-layer address length: 6
    Source: be:57:97:2c:40:79 (be:57:97:2c:40:79)
    Unused: 0000
Internet Protocol Version 4, Src: 172.18.0.3, Dst: 172.18.0.2
Transmission Control Protocol, Src Port: 50591, Dst Port: 1883, Seq: 33, Ack: 281, Len: 4
MQ Telemetry Transport Protocol, Publish Ack

No.     Time           Source                Destination           Protocol Length Info
     54 20.020346      172.18.0.2            172.18.0.3            TCP      72     1883 → 50591 [ACK] Seq=281 Ack=37 Win=509 Len=0 TSval=1275803077 TSecr=4162247902

Frame 54: 72 bytes on wire (576 bits), 72 bytes captured (576 bits)
Linux cooked capture v2
    Protocol: IPv4 (0x0800)
    Interface index: 2
    Link-layer address type: Ethernet (1)
    Packet type: Sent by us (4)
    Link-layer address length: 6
    Source: 8e:7c:46:c7:07:7e (8e:7c:46:c7:07:7e)
    Unused: 0000
Internet Protocol Version 4, Src: 172.18.0.2, Dst: 172.18.0.3
Transmission Control Protocol, Src Port: 1883, Dst Port: 50591, Seq: 281, Ack: 37, Len: 0

No.     Time           Source                Destination           Protocol Length Info
     55 20.190358      172.18.0.6            172.18.0.2            MQTT     107    Publish Message (id=12) [home/sensors/temperatura]

Frame 55: 107 bytes on wire (856 bits), 107 bytes captured (856 bits)
Linux cooked capture v2
    Protocol: IPv4 (0x0800)
    Interface index: 2
    Link-layer address type: Ethernet (1)
    Packet type: Unicast to us (0)
    Link-layer address length: 6
    Source: 32:fe:c8:b9:42:c4 (32:fe:c8:b9:42:c4)
    Unused: 0000
Internet Protocol Version 4, Src: 172.18.0.6, Dst: 172.18.0.2
Transmission Control Protocol, Src Port: 34637, Dst Port: 1883, Seq: 141, Ack: 17, Len: 35
MQ Telemetry Transport Protocol, Publish Message

No.     Time           Source                Destination           Protocol Length Info
